{"$schema":"https://json-schema.org/draft/2020-12/schema","title":"AWA Semantic Game Entity v0.1","description":"Read-oriented semantic entity projection. This is not runtime state.","type":"object","required":["contract","entity_id","kind","namespace","label","semantic_fields","version","provenance_ref"],"properties":{"contract":{"const":"semantic-game-entity.v0.1"},"entity_id":{"type":"string","minLength":1},"kind":{"type":"string","minLength":1},"namespace":{"type":"string","minLength":1},"label":{"type":"string","minLength":1},"semantic_fields":{"type":"object","additionalProperties":true},"version":{"type":"string","pattern":"^v\\d+\\.\\d+$"},"provenance_ref":{"type":"string","minLength":1}},"additionalProperties":false,"$id":"urn:awa:schema:semantic-game-entity-v0-1"}
